{
  "version": 1,
  "source-key": "bullmq-fixture",
  "language": "typescript",
  "surfaces": [
    {
      "id": "message-pub-email-notifications",
      "kind": "message-pub",
      "identifier": "email-notifications",
      "handler": "src/queues/email.ts:3",
      "touches": [
        "src/queues/email.ts"
      ],
      "declared-at": [
        "src/queues/email.ts:3"
      ]
    },
    {
      "id": "message-sub-email-notifications",
      "kind": "message-sub",
      "identifier": "email-notifications",
      "handler": "src/handlers/send.ts:sendEmail",
      "touches": [
        "src/handlers/send.ts"
      ],
      "declared-at": [
        "src/workers/email.ts:4"
      ]
    }
  ]
}
