{
  "version": 1,
  "source-key": "express-fixture",
  "language": "typescript",
  "surfaces": [
    {
      "id": "http-get-health",
      "kind": "http-route",
      "identifier": "GET /health",
      "handler": "src/server.ts:6",
      "touches": [
        "src/server.ts"
      ],
      "declared-at": [
        "src/server.ts:6"
      ]
    },
    {
      "id": "http-get-users",
      "kind": "http-route",
      "identifier": "GET /users",
      "handler": "src/routes/users.ts:listUsers",
      "touches": [
        "src/routes/users.ts",
        "src/services/user-service.ts",
        "src/utils/db.ts"
      ],
      "declared-at": [
        "src/server.ts:9"
      ]
    },
    {
      "id": "http-post-users",
      "kind": "http-route",
      "identifier": "POST /users",
      "handler": "src/routes/users.ts:createUser",
      "touches": [
        "src/routes/users.ts",
        "src/services/user-service.ts",
        "src/utils/db.ts"
      ],
      "declared-at": [
        "src/server.ts:10"
      ]
    }
  ]
}
